<!ELEMENT rutas (ruta+)>

<!ELEMENT ruta (nombre, tipo, transporte, fechaInicio?, horaInicio?, duracion, agencia, descripcion, personasAdecuadas, lugarInicio, direccionInicio, coordenadasInicio, referencias, recomendacion, hitos)>
<!ATTLIST ruta id ID #REQUIRED>

<!ELEMENT nombre (#PCDATA)>
<!ELEMENT tipo (#PCDATA)>
<!ELEMENT transporte (#PCDATA)>
<!ELEMENT fechaInicio (#PCDATA)>
<!ELEMENT horaInicio (#PCDATA)>
<!ELEMENT duracion (#PCDATA)>
<!ELEMENT agencia (#PCDATA)>
<!ELEMENT descripcion (#PCDATA)>
<!ELEMENT personasAdecuadas (#PCDATA)>
<!ELEMENT lugarInicio (#PCDATA)>
<!ELEMENT direccionInicio (#PCDATA)>

<!ELEMENT coordenadasInicio (longitud, latitud, altitud)>
<!ELEMENT longitud (#PCDATA)>
<!ELEMENT latitud (#PCDATA)>
<!ELEMENT altitud (#PCDATA)>

<!ELEMENT referencias (referencia, referencia, referencia, referencia*)>
<!ELEMENT referencia (#PCDATA)>

<!ELEMENT recomendacion (#PCDATA)>

<!ELEMENT hitos (hito, hito, hito, hito, hito+)>
<!ELEMENT hito (nombre, descripcion, coordenadas, distancia, fotografias, videos?)>

<!ELEMENT coordenadas (longitud, latitud, altitud)>

<!ELEMENT distancia (#PCDATA)>
<!ATTLIST distancia unidad (metros|kilometros|millas) #REQUIRED>

<!ELEMENT fotografias (fotografia+)>
<!ELEMENT fotografia (#PCDATA)>

<!ELEMENT videos (video+)>
<!ELEMENT video (#PCDATA)>
