<?xml version="1.0" encoding="UTF-8"?>
<!DOCTYPE rutas SYSTEM "rutas.dtd">
<rutas xmlns:xsi="http://www.w3.org/2001/XMLSchema-instance" 
       xsi:noNamespaceSchemaLocation="rutas.xsd">
    
    <ruta id="ruta001">
        <nombre>Ruta de los Palacios Indianos de Siero</nombre>
        <tipo>Arquitectura y monumentos</tipo>
        <transporte>A pie</transporte>
        <fechaInicio>2025-06-15</fechaInicio>
        <horaInicio>10:00</horaInicio>
        <duracion>3 horas</duracion>
        <agencia>TurismoSiero</agencia>
        <descripcion>
            Descubre el patrimonio indiano del concejo de Siero a través de esta fascinante ruta 
            que recorre los principales palacios y casas de indianos construidos por emigrantes 
            asturianos que hicieron fortuna en América. Un viaje por la historia y la arquitectura 
            que define gran parte del paisaje urbano sierense.
        </descripcion>
        <personasAdecuadas>Todas las edades, accesible para familias con niños</personasAdecuadas>
        <lugarInicio>Plaza de la Campa - Pola de Siero</lugarInicio>
        <direccionInicio>Plaza de la Campa, s/n</direccionInicio>
        <coordenadasInicio>
            <longitud>-5.6647</longitud>
            <latitud>43.3892</latitud>
            <altitud>185</altitud>
        </coordenadasInicio>
        <referencias>
            <referencia>https://www.turismosiero.com/patrimonio-indiano</referencia>
            <referencia>https://es.wikipedia.org/wiki/Arquitectura_indiana_en_Asturias</referencia>
            <referencia>http://www.siero.es/turismo/rutas-culturales</referencia>
            <referencia>https://www.asturias.es/patrimonio/palacios-indianos</referencia>
        </referencias>
        <recomendacion>8</recomendacion>
        
        <hitos>
            <hito>
                <nombre>Casa Consistorial de Siero</nombre>
                <descripcion>
                    Edificio de estilo ecléctico construido a principios del siglo XX, 
                    sede del ayuntamiento que combina elementos tradicionales asturianos 
                    con influencias indianas.
                </descripcion>
                <coordenadas>
                    <longitud>-5.6645</longitud>
                    <latitud>43.3894</latitud>
                    <altitud>186</altitud>
                </coordenadas>
                <distancia unidad="metros">50</distancia>
                <fotografias>
                    <fotografia>ayuntamiento-siero-fachada.jpg</fotografia>
                    <fotografia>ayuntamiento-siero-detalle.jpg</fotografia>
                </fotografias>
            </hito>
            
            <hito>
                <nombre>Palacio de los Álvarez-Buylla</nombre>
                <descripcion>
                    Magnífico ejemplo de arquitectura indiana del siglo XIX, 
                    construido por la familia Álvarez-Buylla tras su regreso de Cuba. 
                    Destaca por su torre mirador y sus jardines.
                </descripcion>
                <coordenadas>
                    <longitud>-5.6623</longitud>
                    <latitud>43.3901</latitud>
                    <altitud>188</altitud>
                </coordenadas>
                <distancia unidad="metros">280</distancia>
                <fotografias>
                    <fotografia>palacio-alvarez-buylla-principal.jpg</fotografia>
                    <fotografia>palacio-alvarez-buylla-torre.jpg</fotografia>
                    <fotografia>palacio-alvarez-buylla-jardines.jpg</fotografia>
                </fotografias>
                <videos>
                    <video>palacio-alvarez-buylla-360.mp4</video>
                </videos>
            </hito>
            
            <hito>
                <nombre>Villa Indiana "El Retiro"</nombre>
                <descripcion>
                    Casa solariega de finales del XIX con elementos decorativos 
                    típicos del estilo colonial cubano adaptado al clima asturiano. 
                    Notable por sus galerías acristaladas y su capilla privada.
                </descripcion>
                <coordenadas>
                    <longitud>-5.6598</longitud>
                    <latitud>43.3915</latitud>
                    <altitud>192</altitud>
                </coordenadas>
                <distancia unidad="metros">420</distancia>
                <fotografias>
                    <fotografia>villa-el-retiro-fachada.jpg</fotografia>
                    <fotografia>villa-el-retiro-galeria.jpg</fotografia>
                    <fotografia>villa-el-retiro-capilla.jpg</fotografia>
                </fotografias>
            </hito>
            
            <hito>
                <nombre>Casa de los Miranda</nombre>
                <descripcion>
                    Edificio de influencia colonial mexicana con característicos 
                    balcones de hierro forjado y patio interior. Actualmente 
                    alberga el Centro Cultural del concejo.
                </descripcion>
                <coordenadas>
                    <longitud>-5.6612</longitud>
                    <latitud>43.3928</latitud>
                    <altitud>190</altitud>
                </coordenadas>
                <distancia unidad="metros">315</distancia>
                <fotografias>
                    <fotografia>casa-miranda-balcones.jpg</fotografia>
                    <fotografia>casa-miranda-patio.jpg</fotografia>
                </fotografias>
                <videos>
                    <video>casa-miranda-interior.mp4</video>
                    <video>casa-miranda-exposicion.mp4</video>
                </videos>
            </hito>
            
            <hito>
                <nombre>Quinta de San José</nombre>
                <descripcion>
                    Conjunto arquitectónico que incluye palacio, capilla y jardines 
                    de estilo francés. Construido por un indiano enriquecido en Argentina, 
                    representa la culminación del estilo palaciego sierense.
                </descripcion>
                <coordenadas>
                    <longitud>-5.6635</longitud>
                    <latitud>43.3885</latitud>
                    <altitud>184</altitud>
                </coordenadas>
                <distancia unidad="metros">650</distancia>
                <fotografias>
                    <fotografia>quinta-san-jose-palacio.jpg</fotografia>
                    <fotografia>quinta-san-jose-capilla.jpg</fotografia>
                    <fotografia>quinta-san-jose-jardines.jpg</fotografia>
                    <fotografia>quinta-san-jose-panoramica.jpg</fotografia>
                </fotografias>
                <videos>
                    <video>quinta-san-jose-aereo.mp4</video>
                </videos>
            </hito>
        </hitos>
    </ruta>
    
    <ruta id="ruta002">
        <nombre>Ruta Gastronómica de las Sidrerías Tradicionales</nombre>
        <tipo>Gastronómica</tipo>
        <transporte>A pie</transporte>
        <duracion>4 horas</duracion>
        <agencia>Sin agencia</agencia>
        <descripcion>
            Recorrido por las sidrerías más auténticas del concejo de Siero, 
            donde podrás degustar la sidra natural y los platos tradicionales 
            asturianos en ambientes familiares y acogedores que mantienen 
            viva la tradición culinaria sierense.
        </descripcion>
        <personasAdecuadas>Adultos, tercera edad</personasAdecuadas>
        <lugarInicio>Sidrería La Pola</lugarInicio>
        <direccionInicio>Calle Marcelino Fernández, 12</direccionInicio>
        <coordenadasInicio>
            <longitud>-5.6652</longitud>
            <latitud>43.3888</latitud>
            <altitud>183</altitud>
        </coordenadasInicio>
        <referencias>
            <referencia>https://www.sidreriasasturias.com/siero</referencia>
            <referencia>https://es.wikipedia.org/wiki/Sidra_de_Asturias</referencia>
            <referencia>https://www.gastronomiaasturiana.com/rutas-sidrerías</referencia>
        </referencias>
        <recomendacion>9</recomendacion>
        
        <hitos>
            <hito>
                <nombre>Sidrería La Pola</nombre>
                <descripcion>
                    Sidrería centenaria que mantiene la tradición del escanciado 
                    y ofrece la auténtica fabada sierense. Ambiente familiar 
                    con decoración tradicional asturiana.
                </descripcion>
                <coordenadas>
                    <longitud>-5.6652</longitud>
                    <latitud>43.3888</latitud>
                    <altitud>183</altitud>
                </coordenadas>
                <distancia unidad="metros">0</distancia>
                <fotografias>
                    <fotografia>sidreria-la-pola-interior.jpg</fotografia>
                    <fotografia>sidreria-la-pola-escanciado.jpg</fotografia>
                </fotografias>
            </hito>
            
            <hito>
                <nombre>Casa Fermín</nombre>
                <descripcion>
                    Restaurante de tradición familiar especializado en cachopo 
                    y carnes a la brasa. Su bodega de sidras naturales es 
                    una de las mejor surtidas del concejo.
                </descripcion>
                <coordenadas>
                    <longitud>-5.6634</longitud>
                    <latitud>43.3902</latitud>
                    <altitud>187</altitud>
                </coordenadas>
                <distancia unidad="metros">380</distancia>
                <fotografias>
                    <fotografia>casa-fermin-comedor.jpg</fotografia>
                    <fotografia>casa-fermin-cachopo.jpg</fotografia>
                    <fotografia>casa-fermin-bodega.jpg</fotografia>
                </fotografias>
            </hito>
            
            <hito>